{
  "schemaVersion": "aag-size-statistics-v1",
  "generatedAt": "2026-05-06T10:53:14.625Z",
  "metric": "effectiveCodeLines",
  "totalFiles": 2714,
  "summary": {
    "p50": 80,
    "p75": 148,
    "p90": 248,
    "p95": 331,
    "p99": 625,
    "max": 1606,
    "mean": 115.19
  },
  "byBucket": [
    {
      "id": "loc.001_010",
      "label": "1-10",
      "count": 203
    },
    {
      "id": "loc.011_020",
      "label": "11-20",
      "count": 183
    },
    {
      "id": "loc.021_030",
      "label": "21-30",
      "count": 159
    },
    {
      "id": "loc.031_040",
      "label": "31-40",
      "count": 162
    },
    {
      "id": "loc.041_050",
      "label": "41-50",
      "count": 156
    },
    {
      "id": "loc.051_060",
      "label": "51-60",
      "count": 190
    },
    {
      "id": "loc.061_070",
      "label": "61-70",
      "count": 160
    },
    {
      "id": "loc.071_080",
      "label": "71-80",
      "count": 151
    },
    {
      "id": "loc.081_090",
      "label": "81-90",
      "count": 149
    },
    {
      "id": "loc.091_100",
      "label": "91-100",
      "count": 116
    },
    {
      "id": "loc.101_150",
      "label": "101-150",
      "count": 424
    },
    {
      "id": "loc.151_200",
      "label": "151-200",
      "count": 242
    },
    {
      "id": "loc.201_300",
      "label": "201-300",
      "count": 231
    },
    {
      "id": "loc.301_plus",
      "label": "301+",
      "count": 186
    }
  ],
  "byLayer": {
    "aag-engine": {
      "fileCount": 23,
      "p50": 146,
      "p90": 301,
      "p95": 327,
      "max": 378
    },
    "app": {
      "fileCount": 11,
      "p50": 17,
      "p90": 75,
      "p95": 175,
      "max": 276
    },
    "application": {
      "fileCount": 602,
      "p50": 67,
      "p90": 192,
      "p95": 254,
      "max": 1410
    },
    "domain": {
      "fileCount": 247,
      "p50": 58,
      "p90": 216,
      "p95": 317,
      "max": 654
    },
    "features/budget": {
      "fileCount": 37,
      "p50": 106,
      "p90": 328,
      "p95": 358,
      "max": 732
    },
    "features/category": {
      "fileCount": 65,
      "p50": 111,
      "p90": 303,
      "p95": 347,
      "max": 419
    },
    "features/clip-export": {
      "fileCount": 4,
      "p50": 7,
      "p90": 47,
      "p95": 55,
      "max": 64
    },
    "features/comparison": {
      "fileCount": 55,
      "p50": 71,
      "p90": 211,
      "p95": 277,
      "max": 461
    },
    "features/cost-detail": {
      "fileCount": 14,
      "p50": 107,
      "p90": 360,
      "p95": 384,
      "max": 403
    },
    "features/forecast": {
      "fileCount": 9,
      "p50": 15,
      "p90": 196,
      "p95": 277,
      "max": 358
    },
    "features/purchase": {
      "fileCount": 10,
      "p50": 101,
      "p90": 263,
      "p95": 316,
      "max": 370
    },
    "features": {
      "fileCount": 1,
      "p50": 59,
      "p90": 59,
      "p95": 59,
      "max": 59
    },
    "features/reports": {
      "fileCount": 6,
      "p50": 65,
      "p90": 288,
      "p95": 370,
      "max": 452
    },
    "features/sales": {
      "fileCount": 10,
      "p50": 15,
      "p90": 239,
      "p95": 247,
      "max": 256
    },
    "features/shared": {
      "fileCount": 2,
      "p50": 4,
      "p90": 7,
      "p95": 7,
      "max": 8
    },
    "features/storage-admin": {
      "fileCount": 14,
      "p50": 74,
      "p90": 212,
      "p95": 299,
      "max": 448
    },
    "features/time-slot": {
      "fileCount": 10,
      "p50": 63,
      "p90": 117,
      "p95": 147,
      "max": 178
    },
    "features/weather": {
      "fileCount": 8,
      "p50": 20,
      "p90": 132,
      "p95": 162,
      "max": 192
    },
    "infrastructure": {
      "fileCount": 208,
      "p50": 105,
      "p90": 272,
      "p95": 332,
      "max": 906
    },
    "presentation": {
      "fileCount": 670,
      "p50": 91,
      "p90": 280,
      "p95": 364,
      "max": 773
    },
    "stories": {
      "fileCount": 23,
      "p50": 62,
      "p90": 145,
      "p95": 155,
      "max": 250
    },
    "test": {
      "fileCount": 262,
      "p50": 88,
      "p90": 233,
      "p95": 344,
      "max": 1066
    },
    "docs": {
      "fileCount": 13,
      "p50": 84,
      "p90": 278,
      "p95": 677,
      "max": 1239
    },
    "projects": {
      "fileCount": 77,
      "p50": 44,
      "p90": 122,
      "p95": 322,
      "max": 1606
    },
    "references": {
      "fileCount": 291,
      "p50": 74,
      "p90": 229,
      "p95": 351,
      "max": 983
    },
    "tools": {
      "fileCount": 42,
      "p50": 125,
      "p90": 291,
      "p95": 306,
      "max": 373
    }
  }
}
